{
  "$schema": "http://json-schema.org/draft-07/schema#",
  "$id": "https://github.com/IntersectMBO/UPLC-CAPE/schemas/cape-tests.schema.json",
  "title": "CAPE Test Specification",
  "description": "Schema for cape-tests.json files that define test cases for UPLC program evaluation with ScriptContext support",
  "type": "object",
  "properties": {
    "version": {
      "type": "string",
      "description": "Schema version",
      "enum": ["3.0.0"]
    },
    "description": {
      "type": "string",
      "description": "Human-readable description of the test suite"
    },
    "data_structures": {
      "type": "object",
      "description": "Shared data structures that can be referenced by tests using @name syntax",
      "patternProperties": {
        "^[a-zA-Z_][a-zA-Z0-9_]*$": {
          "$ref": "#/$defs/data_structure_entry"
        }
      },
      "additionalProperties": false
    },
    "measurements": {
      "type": "array",
      "description": "Test cases that verify correctness AND feed the aggregated metrics (sums, maxima, medians, derived fees and budget percentages). These are the executions that occur in standard protocol operation.",
      "minItems": 1,
      "items": {
        "$ref": "#/$defs/test_case"
      }
    },
    "checks": {
      "type": "array",
      "description": "Test cases that verify correctness only: attacks, malformed inputs, defensive checks, and rejected-path calls in general (a rejecting transaction is stopped by wallet/node validation before it lands on-chain). Their measured budget is recorded in metrics.json evaluations[] but excluded from aggregates.",
      "items": {
        "$ref": "#/$defs/test_case"
      }
    }
  },
  "required": ["version", "measurements"],
  "additionalProperties": false,
  "$defs": {
    "builtin_data_value": {
      "description": "BuiltinData value. Encoded either as a string in UPLC text Data syntax (e.g. \"Constr 0 [I 42, B #cafe]\", \"I 42\", \"B #deadbeef\", \"List [I 1, I 2]\", \"Map [(I 1, B #ab)]\") or as an object in the Plutus JSON detailed schema (e.g. {\"int\": 42}, {\"bytes\": \"deadbeef\"}, {\"constructor\": 0, \"fields\": [...]}, {\"list\": [...]}, {\"map\": [{\"k\": ..., \"v\": ...}]}). A string value of the form \"@name\" is a reference into data_structures.",
      "oneOf": [{ "type": "string" }, { "$ref": "#/$defs/plutus_json_data" }]
    },
    "plutus_json_data": {
      "description": "Plutus Data in the cardano-cli ScriptDataJsonDetailedSchema format.",
      "type": "object",
      "oneOf": [
        {
          "properties": { "int": { "type": "integer" } },
          "required": ["int"],
          "additionalProperties": false
        },
        {
          "properties": { "bytes": { "type": "string", "pattern": "^[0-9a-fA-F]*$" } },
          "required": ["bytes"],
          "additionalProperties": false
        },
        {
          "properties": {
            "list": {
              "type": "array",
              "items": { "$ref": "#/$defs/plutus_json_data" }
            }
          },
          "required": ["list"],
          "additionalProperties": false
        },
        {
          "properties": {
            "map": {
              "type": "array",
              "items": {
                "type": "object",
                "properties": {
                  "k": { "$ref": "#/$defs/plutus_json_data" },
                  "v": { "$ref": "#/$defs/plutus_json_data" }
                },
                "required": ["k", "v"],
                "additionalProperties": false
              }
            }
          },
          "required": ["map"],
          "additionalProperties": false
        },
        {
          "properties": {
            "constructor": { "type": "integer", "minimum": 0 },
            "fields": {
              "type": "array",
              "items": { "$ref": "#/$defs/plutus_json_data" }
            }
          },
          "required": ["constructor", "fields"],
          "additionalProperties": false
        }
      ]
    },
    "data_structure_entry": {
      "type": "object",
      "description": "Shared data structure definition",
      "discriminator": {
        "propertyName": "type"
      },
      "oneOf": [
        {
          "type": "object",
          "description": "BuiltinData entry",
          "properties": {
            "type": {
              "const": "builtin_data"
            },
            "value": {
              "$ref": "#/$defs/builtin_data_value"
            }
          },
          "required": ["type", "value"],
          "additionalProperties": false
        },
        {
          "type": "object",
          "description": "ScriptContext entry",
          "properties": {
            "type": {
              "const": "script_context"
            },
            "script_context": {
              "$ref": "#/$defs/script_context_spec"
            }
          },
          "required": ["type", "script_context"],
          "additionalProperties": false
        }
      ]
    },
    "test_case": {
      "type": "object",
      "description": "Individual test case specification",
      "properties": {
        "name": {
          "type": "string",
          "description": "Unique identifier for the test case",
          "pattern": "^[a-zA-Z0-9_-]+$"
        },
        "description": {
          "type": "string",
          "description": "Human-readable description of what the test verifies"
        },
        "pending": {
          "type": "boolean",
          "description": "Mark test as pending - expected to fail until fixed. When true, test failures don't affect suite success, but if test starts passing, it becomes an error."
        },
        "inputs": {
          "type": "array",
          "description": "Inputs applied to the program sequentially (empty for programs evaluated without arguments)",
          "items": {
            "$ref": "#/$defs/test_input"
          }
        },
        "expected": {
          "$ref": "#/$defs/expected_result"
        }
      },
      "required": ["name", "inputs", "expected"],
      "additionalProperties": false
    },
    "test_input": {
      "type": "object",
      "description": "Input specification for program evaluation",
      "discriminator": {
        "propertyName": "type"
      },
      "oneOf": [
        {
          "type": "object",
          "description": "BuiltinData input",
          "properties": {
            "type": {
              "const": "builtin_data"
            },
            "value": {
              "$ref": "#/$defs/builtin_data_value"
            },
            "file": {
              "type": "string",
              "description": "Path to file containing a BuiltinData value as UPLC text Data syntax (relative to cape-tests.json)"
            }
          },
          "required": ["type"],
          "additionalProperties": false,
          "oneOf": [{ "required": ["value"] }, { "required": ["file"] }]
        },
        {
          "type": "object",
          "description": "UPLC term input (spliced into the program as an argument)",
          "properties": {
            "type": {
              "const": "uplc"
            },
            "value": {
              "type": "string",
              "description": "Inline UPLC term text, e.g. \"(con integer 42)\""
            },
            "file": {
              "type": "string",
              "description": "Path to file containing UPLC term text (relative to cape-tests.json)"
            }
          },
          "required": ["type"],
          "additionalProperties": false,
          "oneOf": [{ "required": ["value"] }, { "required": ["file"] }]
        },
        {
          "type": "object",
          "description": "ScriptContext input",
          "properties": {
            "type": {
              "const": "script_context"
            },
            "script_context": {
              "$ref": "#/$defs/script_context_spec"
            }
          },
          "required": ["type", "script_context"],
          "additionalProperties": false
        }
      ]
    },
    "script_context_spec": {
      "type": "object",
      "description": "ScriptContext construction specification",
      "properties": {
        "baseline": {
          "description": "Baseline context to start from",
          "oneOf": [
            {
              "type": "string",
              "enum": ["spending", "minting", "rewarding", "certifying"],
              "description": "Direct baseline type"
            },
            {
              "type": "string",
              "pattern": "^@[a-zA-Z_][a-zA-Z0-9_]*$",
              "description": "Reference to shared ScriptContext (@name)"
            }
          ]
        },
        "patches": {
          "type": "array",
          "description": "Patch operations to apply to the baseline",
          "items": {
            "$ref": "#/$defs/patch_operation"
          }
        }
      },
      "required": ["baseline", "patches"],
      "additionalProperties": false
    },
    "patch_operation": {
      "type": "object",
      "description": "ScriptContext modification operation",
      "discriminator": {
        "propertyName": "op"
      },
      "oneOf": [
        {
          "type": "object",
          "description": "Add signature to transaction",
          "properties": {
            "op": { "const": "add_signature" },
            "pubkey_hash": {
              "type": "string",
              "description": "PubKey hash as hex string or @reference"
            }
          },
          "required": ["op", "pubkey_hash"],
          "additionalProperties": false
        },
        {
          "type": "object",
          "description": "Remove signature from transaction",
          "properties": {
            "op": { "const": "remove_signature" },
            "pubkey_hash": {
              "type": "string",
              "description": "PubKey hash as hex string or @reference"
            }
          },
          "required": ["op", "pubkey_hash"],
          "additionalProperties": false
        },
        {
          "type": "object",
          "description": "Set transaction redeemer",
          "properties": {
            "op": { "const": "set_redeemer" },
            "redeemer": {
              "$ref": "#/$defs/builtin_data_value"
            }
          },
          "required": ["op", "redeemer"],
          "additionalProperties": false
        },
        {
          "type": "object",
          "description": "Add input UTXO to transaction",
          "properties": {
            "op": { "const": "add_input_utxo" },
            "utxo_ref": {
              "type": "string",
              "description": "UTXO reference as 'txid:index'"
            },
            "value": {
              "$ref": "#/$defs/value_spec"
            },
            "is_own_input": {
              "type": "boolean",
              "description": "Whether this is the UTXO being spent by the script"
            },
            "datum": {
              "$ref": "#/$defs/builtin_data_value"
            }
          },
          "required": ["op", "utxo_ref", "value", "is_own_input"],
          "additionalProperties": false
        },
        {
          "type": "object",
          "description": "Add output UTXO to transaction",
          "properties": {
            "op": { "const": "add_output_utxo" },
            "address": {
              "$ref": "#/$defs/address_spec"
            },
            "value": {
              "$ref": "#/$defs/value_spec"
            },
            "datum": {
              "$ref": "#/$defs/builtin_data_value"
            }
          },
          "required": ["op", "address", "value"],
          "additionalProperties": false
        },
        {
          "type": "object",
          "description": "Remove output UTXO by index",
          "properties": {
            "op": { "const": "remove_output_utxo" },
            "index": {
              "type": "integer",
              "description": "Zero-based index of output to remove",
              "minimum": 0
            }
          },
          "required": ["op", "index"],
          "additionalProperties": false
        },
        {
          "type": "object",
          "description": "Set transaction validity time range",
          "properties": {
            "op": { "const": "set_valid_range" },
            "from_time": {
              "type": "integer",
              "description": "Inclusive lower bound, POSIX time in milliseconds (optional). Encoded as the ledger does: LowerBound (Finite t) True. Omitted means NegInf.",
              "minimum": 0
            },
            "to_time": {
              "type": "integer",
              "description": "Exclusive upper bound, POSIX time in milliseconds (optional). Encoded as the ledger does: UpperBound (Finite t) False. Omitted means PosInf.",
              "minimum": 0
            }
          },
          "required": ["op"],
          "additionalProperties": false
        },
        {
          "type": "object",
          "description": "Set the datum of the script's own input",
          "properties": {
            "op": { "const": "set_script_datum" },
            "datum": {
              "$ref": "#/$defs/builtin_data_value"
            }
          },
          "required": ["op", "datum"],
          "additionalProperties": false
        }
      ]
    },
    "value_spec": {
      "type": "object",
      "description": "Multi-asset value: lovelace plus optional native assets",
      "properties": {
        "lovelace": {
          "type": "integer",
          "description": "Lovelace amount",
          "minimum": 0
        },
        "assets": {
          "type": "array",
          "description": "Native assets included in the value",
          "items": {
            "type": "object",
            "properties": {
              "currency_symbol": {
                "type": "string",
                "description": "Policy id as hex string or @reference"
              },
              "token_name": {
                "type": "string",
                "description": "Token name as hex string or @reference"
              },
              "quantity": {
                "type": "integer",
                "description": "Asset quantity"
              }
            },
            "required": ["currency_symbol", "token_name", "quantity"],
            "additionalProperties": false
          }
        }
      },
      "required": ["lovelace"],
      "additionalProperties": false
    },
    "address_spec": {
      "type": "object",
      "description": "Cardano address specification with structural format",
      "discriminator": {
        "propertyName": "type"
      },
      "oneOf": [
        {
          "type": "object",
          "description": "Script address with script hash",
          "properties": {
            "type": { "const": "script" },
            "script_hash": {
              "type": "string",
              "description": "Script hash as hex string or 'standard' for all-1s hash",
              "oneOf": [
                {
                  "pattern": "^[0-9a-fA-F]+$"
                },
                {
                  "const": "standard"
                }
              ]
            }
          },
          "required": ["type", "script_hash"],
          "additionalProperties": false
        },
        {
          "type": "object",
          "description": "Public key address with pubkey hash",
          "properties": {
            "type": { "const": "pubkey" },
            "pubkey_hash": {
              "type": "string",
              "description": "Public key hash as 64-character hex string or @reference"
            }
          },
          "required": ["type", "pubkey_hash"],
          "additionalProperties": false
        }
      ]
    },
    "expected_result": {
      "type": "object",
      "description": "Expected evaluation result",
      "properties": {
        "type": {
          "type": "string",
          "description": "Type of expected result",
          "enum": ["value", "error"]
        },
        "content": {
          "type": "string",
          "description": "Inline expected pretty-printed UPLC term"
        },
        "file": {
          "type": "string",
          "description": "Path to file containing expected result (relative to cape-tests.json)"
        }
      },
      "required": ["type"],
      "additionalProperties": false,
      "if": {
        "properties": {
          "type": { "const": "value" }
        }
      },
      "then": {
        "oneOf": [{ "required": ["content"] }, { "required": ["file"] }]
      },
      "else": {
        "not": {
          "anyOf": [{ "required": ["content"] }, { "required": ["file"] }]
        }
      }
    }
  }
}
