{
  "version": "3.0.0",
  "description": "Test cases for two-party escrow smart contract validator",
  "data_structures": {
    "buyer_pubkey": {
      "type": "builtin_data",
      "value": "B #aaaaaaaaaaaaaaaaaaaaaaaaaaaaaaaaaaaaaaaaaaaaaaaaaaaaaaaaaaaaaaaa"
    },
    "seller_pubkey": {
      "type": "builtin_data",
      "value": "B #bbbbbbbbbbbbbbbbbbbbbbbbbbbbbbbbbbbbbbbbbbbbbbbbbbbbbbbbbbbbbbbb"
    },
    "impostor_pubkey": {
      "type": "builtin_data",
      "value": "B #cccccccccccccccccccccccccccccccccccccccccccccccccccccccccccccccc"
    },
    "deposited_escrow_datum": {
      "type": "builtin_data",
      "value": "Constr 0 [Constr 0 [], I 1000]"
    },
    "accepted_escrow_datum": {
      "type": "builtin_data",
      "value": "Constr 0 [Constr 1 [], I 1000]"
    },
    "refunded_escrow_datum": {
      "type": "builtin_data",
      "value": "Constr 0 [Constr 2 [], I 1000]"
    },
    "successful_deposit": {
      "type": "script_context",
      "script_context": {
        "baseline": "spending",
        "patches": [
          {
            "op": "set_redeemer",
            "redeemer": "I 0"
          },
          {
            "op": "add_signature",
            "pubkey_hash": "@buyer_pubkey"
          },
          {
            "op": "set_valid_range",
            "from_time": 1000,
            "to_time": 1001
          },
          {
            "op": "add_input_utxo",
            "utxo_ref": "3333333333333333333333333333333333333333333333333333333333333333:0",
            "value": {
              "lovelace": 75000000
            },
            "is_own_input": false
          },
          {
            "op": "add_output_utxo",
            "address": {
              "type": "script",
              "script_hash": "1111111111111111111111111111111111111111111111111111111111"
            },
            "value": {
              "lovelace": 75000000
            },
            "datum": "@deposited_escrow_datum"
          }
        ]
      }
    },
    "successful_accept": {
      "type": "script_context",
      "script_context": {
        "baseline": "spending",
        "patches": [
          {
            "op": "set_redeemer",
            "redeemer": "I 1"
          },
          {
            "op": "set_script_datum",
            "datum": "@deposited_escrow_datum"
          },
          {
            "op": "add_signature",
            "pubkey_hash": "@seller_pubkey"
          },
          {
            "op": "add_input_utxo",
            "utxo_ref": "4444444444444444444444444444444444444444444444444444444444444444:0",
            "value": {
              "lovelace": 75000000
            },
            "is_own_input": true,
            "datum": "@deposited_escrow_datum"
          },
          {
            "op": "add_output_utxo",
            "address": {
              "type": "pubkey",
              "pubkey_hash": "@seller_pubkey"
            },
            "value": {
              "lovelace": 75000000
            }
          }
        ]
      }
    },
    "successful_refund": {
      "type": "script_context",
      "script_context": {
        "baseline": "spending",
        "patches": [
          {
            "op": "set_redeemer",
            "redeemer": "I 2"
          },
          {
            "op": "set_script_datum",
            "datum": "@deposited_escrow_datum"
          },
          {
            "op": "add_signature",
            "pubkey_hash": "@buyer_pubkey"
          },
          {
            "op": "set_valid_range",
            "from_time": 2801
          },
          {
            "op": "add_input_utxo",
            "utxo_ref": "3333333333333333333333333333333333333333333333333333333333333333:1",
            "value": {
              "lovelace": 75000000
            },
            "is_own_input": true,
            "datum": "@deposited_escrow_datum"
          },
          {
            "op": "add_output_utxo",
            "address": {
              "type": "pubkey",
              "pubkey_hash": "@buyer_pubkey"
            },
            "value": {
              "lovelace": 75000000
            }
          }
        ]
      }
    }
  },
  "measurements": [
    {
      "name": "deposit_successful",
      "description": "Deposit with buyer signature and exactly 75 ADA should succeed",
      "expected": {
        "type": "value",
        "content": "(con unit ())"
      },
      "inputs": [
        {
          "type": "script_context",
          "script_context": {
            "baseline": "@successful_deposit",
            "patches": []
          }
        }
      ]
    },
    {
      "name": "accept_successful",
      "description": "Accept with seller signature and 75 ADA to seller should succeed",
      "expected": {
        "type": "value",
        "content": "(con unit ())"
      },
      "inputs": [
        {
          "type": "script_context",
          "script_context": {
            "baseline": "@successful_accept",
            "patches": []
          }
        }
      ]
    },
    {
      "name": "accept_with_multiple_inputs",
      "description": "Accept with multiple script inputs (ambiguous state - expects pass)",
      "expected": {
        "type": "value",
        "content": "(con unit ())"
      },
      "inputs": [
        {
          "type": "script_context",
          "script_context": {
            "baseline": "spending",
            "patches": [
              {
                "op": "set_redeemer",
                "redeemer": "I 1"
              },
              {
                "op": "add_signature",
                "pubkey_hash": "@seller_pubkey"
              },
              {
                "op": "set_script_datum",
                "datum": "@deposited_escrow_datum"
              },
              {
                "op": "add_input_utxo",
                "utxo_ref": "3333333333333333333333333333333333333333333333333333333333333333:0",
                "value": {
                  "lovelace": 75000000
                },
                "is_own_input": true
              },
              {
                "op": "add_input_utxo",
                "utxo_ref": "3333333333333333333333333333333333333333333333333333333333333333:1",
                "value": {
                  "lovelace": 75000000
                },
                "is_own_input": true
              },
              {
                "op": "add_output_utxo",
                "address": {
                  "type": "pubkey",
                  "pubkey_hash": "@seller_pubkey"
                },
                "value": {
                  "lovelace": 75000000
                }
              }
            ]
          }
        }
      ]
    },
    {
      "name": "accept_with_datum_attached",
      "description": "Accept with datum attached to seller's payment (expects pass)",
      "expected": {
        "type": "value",
        "content": "(con unit ())"
      },
      "inputs": [
        {
          "type": "script_context",
          "script_context": {
            "baseline": "@successful_accept",
            "patches": []
          }
        }
      ]
    },
    {
      "name": "accept_with_multiple_outputs_to_seller",
      "description": "Accept with payment split across two outputs to seller (50+25 ADA - expects pass)",
      "expected": {
        "type": "value",
        "content": "(con unit ())"
      },
      "inputs": [
        {
          "type": "script_context",
          "script_context": {
            "baseline": "spending",
            "patches": [
              {
                "op": "set_redeemer",
                "redeemer": "I 1"
              },
              {
                "op": "add_signature",
                "pubkey_hash": "@seller_pubkey"
              },
              {
                "op": "set_script_datum",
                "datum": "@deposited_escrow_datum"
              },
              {
                "op": "add_input_utxo",
                "utxo_ref": "3333333333333333333333333333333333333333333333333333333333333333:1",
                "value": {
                  "lovelace": 75000000
                },
                "is_own_input": true
              },
              {
                "op": "add_output_utxo",
                "address": {
                  "type": "pubkey",
                  "pubkey_hash": "@seller_pubkey"
                },
                "value": {
                  "lovelace": 50000000
                }
              },
              {
                "op": "add_output_utxo",
                "address": {
                  "type": "pubkey",
                  "pubkey_hash": "@seller_pubkey"
                },
                "value": {
                  "lovelace": 25000000
                }
              }
            ]
          }
        }
      ]
    },
    {
      "name": "refund_successful",
      "description": "Refund after deadline with buyer signature should succeed",
      "expected": {
        "type": "value",
        "content": "(con unit ())"
      },
      "inputs": [
        {
          "type": "script_context",
          "script_context": {
            "baseline": "@successful_refund",
            "patches": []
          }
        }
      ]
    },
    {
      "name": "refund_after_exact_deadline",
      "description": "Refund exactly 1 second after deadline expiry should succeed",
      "expected": {
        "type": "value",
        "content": "(con unit ())"
      },
      "inputs": [
        {
          "type": "script_context",
          "script_context": {
            "baseline": "@successful_refund",
            "patches": []
          }
        }
      ]
    },
    {
      "name": "refund_with_multiple_inputs",
      "description": "Refund with multiple script inputs should succeed (no single input validation)",
      "expected": {
        "type": "value",
        "content": "(con unit ())"
      },
      "inputs": [
        {
          "type": "script_context",
          "script_context": {